{
  "schema_version": 1,
  "message_id": "01J9ZX3Q4R5S6T7V8W9XAYBZC0",
  "operation_id": "01J9ZX3Q4R5S6T7V8W9XAYBZC1",
  "correlation_id": "6f1c2a4e-8b7d-4c3a-9e2f-1a2b3c4d5e6f",
  "causation_id": null,
  "owner_ref": "owner:radar-pilot",
  "kind": "browser.read",
  "deadline": "2026-10-03T12:05:00Z",
  "attempt": 1,
  "payload": {
    "schema_version": 1,
    "capability_id": "fixture.direct.read_listing",
    "target": {
      "origin": "http://127.0.0.1:8080",
      "path": "/listings?q=perfume"
    },
    "fixture_only": true,
    "mode": "direct",
    "batch": 3,
    "deadline_ms": 60000
  }
}
